subject_title,id,title,issue_area_title,narrative,metro_future_goal
A Diverse and Productive Workforce,235,"Unemployment Gap, Regional Urban Center to regional average",Economy,"Unemployment gaps by educational attainment, race and ethnicity, and community type have remained stubbornly persistent, with no definitive movement since 2000. Educational attainment is a significant factor in employment outcomes in the region – for an adult in the region without a college degree, the unemployment rate is double that of an adult with a college degree; for an adult without a high school diploma it is triple. Race also plays a significant role in employment outcomes, especially for Black residents: the unemployment rate for Blacks in the region is 6 points higher than that of Whites, a larger gap than 2000’s 4 points. Across all educational attainment levels, Blacks have the highest rate of unemployment of any race or ethnicity. This points to troubling and persistent discrimination in employment practices.  The unemployment gap between Latino and White Metro Boston adults has closed a marginal 1 point, from 4 points in 2000 to 3. 
Metro Boston’s unemployment rate for adults ages 16 and older  is lower than the national average for Whites and Blacks, but higher for Latinos and Asians. The unemployment gap between Black adults ages 16 and over in Metro Boston is 0.3 percentage points lower than it is for the nation overall. For Latinos, the gap is 2.2 points greater than that of the nation. Metro Boston has the second largest unemployment gap between Latinos and Whites, out of the 25 most populous U.S. metros.
Unemployment is inherently bad for day-to-day financial well-being, but it also hinders long-term wealth building, because during periods of unemployment people are likely to need to dip into savings in order to make up for lost wages. The disproportionate rate of unemployment between adults of color and white adults accounts for 9% of the growing national racial wealth gap, according to a Brandeis University study. 
The long-term implications of such pronounced gaps in unemployment are not good for the region. Racial gaps, especially, are troubling for our region, which is becoming more diverse every year. While trends show increased educational attainment across races, which should fare well for regional employment in knowledge-based jobs, discriminatory hiring limits opportunity for residents of color who are qualified for those jobs, and imposes an artificial limit on the applicant pool from which employers have to draw from.","38, 39"
A Diverse and Productive Workforce,231,Unemployment rate for all workers age 16 and over,Economy,"The annual unemployment rate in Metro Boston was 6.4% in 2013, lower than the 7.1% rate of Massachusetts, and the 7.4% rate of the nation. The region’s annual unemployment rate has been consistently lower than that of the state and nation since the early 1990’s, except for in 2002, just following the 2001 recession, when the region and the state had the same annual rate.
Yearly statistics show a steady downward trend in the Metro Boston’s unemployment rate after it peaked in 2009 following the Great Recession, although it ticked upward in 2013. As of January, 2014 the region had 158,174 unemployed workers, 18,287 fewer than in January of 2013.",39
A Diverse and Productive Workforce,247,"Youth ages 16-24 not in education, employment or training (NEET)","Education, Economy, Equity","[PLEASE NOTE: Still working through this analysis] 
Working age youth in the region, ages 16-24, have far greater rates of unemployment than adults. There are clear racial/ethnic and spatial gaps in youth unemployment. The gap is most stark in the Inner Core, where Black youth have the highest unemployment rate in the region at 30.5%, and White youth have the lowest in the region, at 9.4%.",
